{
  "schemaVersion": 1,
  "artifactType": "advisor-assessment-request",
  "createdAt": "2026-09-18T00:00:00Z",
  "requestId": "advisor-request-fixture-0001",
  "projectRoot": "C:/fixture/project",
  "profileId": "profile-0123456789abcdef",
  "property": "properties/123",
  "webStream": "properties/123/dataStreams/456",
  "site": "sc-domain:example.test",
  "verifiedOrigin": "https://example.test",
  "question": "What is happening with this website?",
  "language": "en",
  "mode": "broad",
  "period": {"mode": "last-complete-days", "days": 28, "from": null, "to": null},
  "comparisons": ["previous-period"],
  "businessModel": "lead_generation",
  "baselineRef": null,
  "measurementPlanRef": null,
  "gtmContainer": null,
  "knownChangesAfter": null,
  "capabilities": {"searchConsole": "ready"},
  "contentSha256": "a6243e4c2e9c3d123a7714810dbc5a084a05a86948e5a8336bb06c91cfb924dd"
}
